Grapheme	Segments	CLPA	Structure	Unicode	Frequency	Reflexes	Examples
⁵⁵	⁵⁵	⁵⁵	t	U+2075 U+2075	2271	Chuanqiandian, Southern Guizhou,Chuanqiandian, Central Guizhou,Qiandong, West,Chuanqiandian,Baheng, East,Baheng, West,Luobuohe, Eastern,Luobuohe, Western,Chuanqiandian, Northeast Yunnan	vei⁵⁵, ⁿtuŋ⁵⁵, mi⁵⁵, m̥en⁵⁵, ⁿqə̃⁵⁵
³¹	³¹	³¹	t	U+00b3 U+00b9	1718	Chuanqiandian, Central Guizhou,Baheng, East,Chuanqiandian, Northeast Yunnan,Chuanqiandian,Baheng, West,Luobuohe, Eastern,Luobuohe, Western	ⁿɢwaŋ³¹, ⁿɢwɑŋ³¹, ⁿto³¹, na³¹, ʔlu³¹
³³	³³	³³	t	U+00b3 U+00b3	1300	Luobuohe, Western,Chuanqiandian, Southern Guizhou,Chuanqiandian,Luobuohe, Eastern,Baheng, West,Baheng, East,Qiandong, East,Qiandong, West,Chuanqiandian, Northeast Yunnan	tau³³, qa³³, waŋ³³, waŋ³³, ʔuŋ³³
³⁵	³⁵	³⁵	t	U+00b3 U+2075	1140	Qiandong, East,Chuanqiandian, Southern Guizhou,Chuanqiandian, Northeast Yunnan,Luobuohe, Western,Baheng, West,Baheng, East	tu³⁵, qaŋ³⁵, ho³⁵, zɦaɯ³⁵, heu³⁵
²⁴	²⁴	²⁴	t	U+00b2 U+2074	902	Chuanqiandian,Chuanqiandian, Central Guizhou,Qiandong, East,Luobuohe, Eastern	zəu²⁴, lã²⁴, ljo²⁴, tju²⁴, ʔeu²⁴
⁴⁴	⁴⁴	⁴⁴	t	U+2074 U+2074	771	Chuanqiandian, Central Guizhou,Luobuohe, Eastern,Luobuohe, Western,Baheng, East,Chuanqiandian, Southern Guizhou,Baheng, West,Qiandong, East,Chuanqiandian,Qiandong, West	ljɔ⁴⁴, tou⁴⁴, tue⁴⁴, tei⁴⁴, qei⁴⁴
¹³	¹³	¹³	t	U+00b9 U+00b3	689	Baheng, West,Luobuohe, Western,Chuanqiandian, Northeast Yunnan,Qiandong, East,Chuanqiandian,Chuanqiandian, Southern Guizhou,Qiandong, West,Chuanqiandian, Central Guizhou	tso¹³, ɬa¹³, qou¹³, ho¹³, lje¹³
²/⁰	²/⁰	²/⁰	t	U+00b2 U+002f U+2070	675	Baheng, West,Chuanqiandian, Central Guizhou,Luobuohe, Eastern,Luobuohe, Western	ʔə²/⁰, tə²/⁰, tə²/⁰, ʔa²/⁰, ʔə²/⁰
¹¹	¹¹	¹¹	t	U+00b9 U+00b9	519	Luobuohe, Western,Baheng, East,Baheng, West,Qiandong, West,Chuanqiandian, Southern Guizhou,Chuanqiandian, Northeast Yunnan	ⁿdʑʱau¹¹, teŋ¹¹, po¹¹, ɬoŋ¹¹, pi¹¹
⁵³	⁵³	⁵³	t	U+2075 U+00b3	481	Chuanqiandian, Northeast Yunnan,Baheng, West,Qiandong, West,Baheng, East,Qiandong, East,Chuanqiandian, Southern Guizhou	sou⁵³, ⁿtoŋ⁵³, zo⁵³, lje⁵³, sau⁵³
²²	²²	²²	t	U+00b2 U+00b2	463	Chuanqiandian, Southern Guizhou,Chuanqiandian, Central Guizhou,Qiandong, West,Qiandong, East	ʑi²², me²², ʑin²², ʑə²², vuŋ²²
⁴²	⁴²	⁴²	t	U+2074 U+00b2	409	Baheng, West,Chuanqiandian, Southern Guizhou,Chuanqiandian, Central Guizhou	tæn⁴², ta⁴², ʔõ⁴², je⁴², tɕa⁴²
³/⁰	³/⁰	³/⁰	t	U+00b3 U+002f U+2070	277	Baheng, East,Baheng, West	ʔa³/⁰, la³/⁰, la³/⁰, qa³/⁰, la³/⁰
⁴³	⁴³	⁴³	t	U+2074 U+00b3	265	Chuanqiandian, Central Guizhou,Chuanqiandian	n̥o⁴³, qo⁴³, tɬaŋ⁴³, n̥o⁴³, tʂʰua⁴³
²¹	²¹	²¹	t	U+00b2 U+00b9	258	Chuanqiandian, Southern Guizhou,Chuanqiandian,Qiandong, West	ɭe²¹, teu²¹, to²¹, paŋ²¹, mei²¹
³¹³	³¹³	³¹³	t	U+00b3 U+00b9 U+00b3	168	Baheng, East	tau³¹³, ʑa³¹³, qʰuŋ³¹³, kai³¹³, va³¹³
⁵/⁰	⁵/⁰	⁵/⁰	t	U+2075 U+002f U+2070	165	Luobuohe, Western,Luobuohe, Eastern	qo⁵/⁰, qo⁵/⁰, qo⁵/⁰, qo⁵/⁰, pə⁵/⁰
³²	³²	³²	t	U+00b3 U+00b2	72	Chuanqiandian, Southern Guizhou	pu³², koŋ³², kaŋ³², ʐa³², toŋ³²
²³²	²³²	²³²	t	U+00b2 U+00b3 U+00b2	44	Chuanqiandian, Southern Guizhou	hoŋ²³², saŋ²³², ʐæ²³², ɦo²³², hoŋ²³²
²¹²	²¹²	²¹²	t	U+00b2 U+00b9 U+00b2	13	Qiandong, East	ta²¹², peŋ²¹², pɛ²¹², maŋ²¹², taŋ²¹²
²³¹	²³¹	²³¹	t	U+00b2 U+00b3 U+00b9	1	Baheng, East	nuŋ²³¹
⁵⁴	⁵⁴	⁵⁴	t	U+2075 U+2074	1	Chuanqiandian	plou⁵⁴
⁵²	⁵²	⁵²	t	U+2075 U+00b2	1	Chuanqiandian, Southern Guizhou	tæ⁵²
¹³¹	¹³¹	¹³¹	t	U+00b9 U+00b3 U+00b9	1	Chuanqiandian, Southern Guizhou	nəŋ¹³¹
⁴/⁰	⁴/⁰	⁴/⁰	t	U+2074 U+002f U+2070	1	Baheng, West	ʔa⁴/⁰
aŋ	a ŋ	a ŋ	n c	U+0061 U+0020 U+014b	622	Chuanqiandian, Central Guizhou,Chuanqiandian, Northeast Yunnan,Luobuohe, Western,Qiandong, West,Qiandong, East,Baheng, East,Luobuohe, Eastern,Chuanqiandian, Southern Guizhou,Chuanqiandian,Baheng, West	taŋ³¹, qaŋ³¹, qaŋ³⁵, tɬaŋ⁴³, ʔaŋ⁵⁵
oŋ	o ŋ	o ŋ	n c	U+006f U+0020 U+014b	327	Qiandong, East,Chuanqiandian, Northeast Yunnan,Baheng, East,Chuanqiandian,Baheng, West,Chuanqiandian, Southern Guizhou,Luobuohe, Western	toŋ⁵⁵, ʔoŋ⁴⁴, toŋ⁵⁵, ⁿtoŋ⁵³, toŋ²⁴
uŋ	u ŋ	u ŋ	n c	U+0075 U+0020 U+014b	279	Qiandong, East,Qiandong, West,Baheng, East,Luobuohe, Eastern	ⁿtuŋ⁵⁵, tuŋ⁵⁵, ʔuŋ³³, vuŋ²², nuŋ⁵³
en	e n	e n	n c	U+0065 U+0020 U+006e	230	Baheng, West,Baheng, East,Qiandong, West,Chuanqiandian,Chuanqiandian, Southern Guizhou,Qiandong, East,Luobuohe, Eastern,Luobuohe, Western	m̥en⁵⁵, ʁʷen³¹, ⁿtsen⁵⁵, ʑen²⁴, ʑen²⁴
in	i n	i n	n c	U+0069 U+0020 U+006e	117	Baheng, West,Chuanqiandian,Chuanqiandian, Southern Guizhou,Qiandong, West,Qiandong, East,Luobuohe, Eastern,Luobuohe, Western	ʑin²², nʲin⁵³, ʑin¹³, ⁿbin³¹, ʑin³¹
eŋ	e ŋ	e ŋ	n c	U+0065 U+0020 U+014b	100	Qiandong, East,Baheng, West,Baheng, East	teŋ¹¹, leŋ²⁴, seŋ³¹, leŋ³¹³, peŋ¹³
ɑŋ	ɑ ŋ	ɑ ŋ	n c	U+0251 U+0020 U+014b	82	Luobuohe, Eastern,Luobuohe, Western	tɑŋ³¹, qɑŋ³¹, tɑŋ³⁵, ⁿpɑŋ³⁵, ⁿdzɑŋ⁵⁵
an	a n	a n	n c	U+0061 U+0020 U+006e	73	Baheng, West,Chuanqiandian, Southern Guizhou,Qiandong, East	kan⁴², kan³³, ɕan⁵³, tʰan¹³, van²²
æn	æ n	æ n	n c	U+00e6 U+0020 U+006e	31	Chuanqiandian, Southern Guizhou	tæn⁴², ɭæn⁵³, sæn⁴², næn⁴⁴, hæn⁴²
iŋ	i ŋ	i ŋ	n c	U+0069 U+0020 U+014b	25	Baheng, East,Baheng, West	tɕiŋ³¹, liŋ³³, liŋ³³, tɕiŋ³³, m̥iŋ³¹³
əŋ	ə ŋ	ə ŋ	n c	U+0259 U+0020 U+014b	16	Chuanqiandian, Southern Guizhou	nəŋ¹³¹, məŋ²², məŋ²², məŋ²², nəŋ¹³
un	u n	u n	n c	U+0075 U+0020 U+006e	9	Qiandong, East,Qiandong, West	kʰun³³, kun²¹, kun³³, tʰun³³, ɬʲun³³
am	a m	a m	n c	U+0061 U+0020 U+006d	1	Qiandong, West	ʔam⁵³
ar	a r	a r	n c	U+0061 U+0020 U+0072	1	Luobuohe, Eastern	ar⁵⁵
ɛŋ	ɛ ŋ	ɛ ŋ	n c	U+025b U+0020 U+014b	1	Baheng, West	nɛŋ¹¹
a	a	a	n	U+0061	1651	Luobuohe, Western,Chuanqiandian,Chuanqiandian, Southern Guizhou,Qiandong, East,Chuanqiandian, Central Guizhou,Qiandong, West,Baheng, East,Chuanqiandian, Northeast Yunnan,Baheng, West,Luobuohe, Eastern	na³¹, ɬa¹³, ta⁴², qa³³, ʔa³/⁰
o	o	o	n	U+006f	1216	Chuanqiandian, Southern Guizhou,Chuanqiandian, Central Guizhou,Qiandong, West,Qiandong, East,Chuanqiandian, Northeast Yunnan,Baheng, East,Baheng, West,Chuanqiandian,Luobuohe, Western,Luobuohe, Eastern	tso¹³, qo⁵/⁰, ⁿto³¹, qo⁵/⁰, to⁵⁵
i	i	i	n	U+0069	871	Qiandong, East,Chuanqiandian, Central Guizhou,Chuanqiandian, Southern Guizhou,Baheng, West,Luobuohe, Eastern,Baheng, East,Luobuohe, Western,Qiandong, West,Chuanqiandian,Chuanqiandian, Northeast Yunnan	mi⁵⁵, ɬi⁵⁵, li, ɬi⁵⁵, ʑi²²
ə	ə	ə	n	U+0259	796	Qiandong, East,Chuanqiandian,Baheng, East,Chuanqiandian, Northeast Yunnan,Chuanqiandian, Southern Guizhou,Luobuohe, Eastern,Chuanqiandian, Central Guizhou,Luobuohe, Western	ʔə²/⁰, tə²/⁰, tə²/⁰, ʔə²/⁰, tə²/⁰
u	u	u	n	U+0075	767	Qiandong, East,Chuanqiandian,Qiandong, West,Baheng, East,Chuanqiandian, Central Guizhou,Chuanqiandian, Southern Guizhou,Luobuohe, Eastern,Baheng, West,Chuanqiandian, Northeast Yunnan,Luobuohe, Western	zu, tu³⁵, tu⁵⁵, tu⁵⁵, n̥u⁵⁵
e	e	e	n	U+0065	618	Chuanqiandian, Northeast Yunnan,Qiandong, East,Luobuohe, Eastern,Chuanqiandian, Central Guizhou,Chuanqiandian, Southern Guizhou,Luobuohe, Western,Baheng, West,Chuanqiandian,Qiandong, West,Baheng, East	me²², ve⁵⁵, ve⁵⁵, ɭe²¹, ʔe⁴⁴
ei	ei	ei	n	U+0065 U+0069	454	Luobuohe, Western,Chuanqiandian, Southern Guizhou,Luobuohe, Eastern,Baheng, East,Qiandong, East,Qiandong, West,Baheng, West	vei⁵⁵, tei⁴⁴, qei⁴⁴, vei⁵⁵, nʲei³³
au	au	au	n	U+0061 U+0075	387	Luobuohe, Eastern,Qiandong, East,Baheng, West,Baheng, East,Chuanqiandian,Chuanqiandian, Northeast Yunnan	ⁿdʑʱau¹¹, tau³³, tɕau⁵⁵, ɢau³¹, tau³¹³
eu	eu	eu	n	U+0065 U+0075	286	Baheng, West,Baheng, East,Chuanqiandian,Qiandong, West,Qiandong, East	ʔeu²⁴, heu³⁵, ʔeu²⁴, tsʰeu³³, ʔeu⁴⁴
ɔ	ɔ	ɔ	n	U+0254	219	Baheng, West,Chuanqiandian, Southern Guizhou,Qiandong, West	tɔ⁵⁵, nɔ³¹, sɔ⁴², pɔ¹¹, sɔ²²
ɛ	ɛ	ɛ	n	U+025b	200	Qiandong, West,Luobuohe, Western,Baheng, West,Luobuohe, Eastern,Qiandong, East,Chuanqiandian, Central Guizhou	tɛ⁴², tɛ²⁴, tɛ²⁴, pɛ³¹, kɛ³³
ai	ai	ai	n	U+0061 U+0069	175	Luobuohe, Eastern,Chuanqiandian, Northeast Yunnan,Baheng, West,Chuanqiandian,Baheng, East	tɬai⁴⁴, lʱai¹¹, ⁿʈai²⁴, fai⁴³, fai³³
ou	ou	ou	n	U+006f U+0075	173	Qiandong, East,Chuanqiandian	sou⁵³, tou⁴⁴, qou¹³, tɕou⁴⁴, tʂʰou⁵⁵
ɑ	ɑ	ɑ	n	U+0251	152	Luobuohe, Eastern,Luobuohe, Western	n̥ɑ³¹, ɬɑ³⁵, vɑ³⁵, lɑ³¹, ⁿdzɑ³¹
æ	æ	æ	n	U+00e6	128	Luobuohe, Western,Qiandong, West,Chuanqiandian, Southern Guizhou	tɕæ⁴², tæ, kæ⁵⁵, kæ⁴², kæ⁵⁵
õ	õ	õ	n	U+00f5	122	Chuanqiandian, Central Guizhou	ʔõ⁴², ʔõ²⁴, sõ⁴², ʑõ⁴², ʐõ⁵⁵
ɿ	ɿ	ɿ	n	U+027f	106	Baheng, West,Chuanqiandian, Southern Guizhou,Luobuohe, Western,Luobuohe, Eastern,Qiandong, East,Baheng, East,Chuanqiandian, Northeast Yunnan	tsɿ³³, tsɿ³/⁰, tsɿ³/⁰, tsɿ³³, tsɿ³/⁰
ɯ	ɯ	ɯ	n	U+026f	105	Chuanqiandian, Southern Guizhou,Chuanqiandian, Northeast Yunnan,Chuanqiandian, Central Guizhou	tʂɯ²², sʰɯ¹³, ⁿzɯ²², ⁿtsɯ⁵⁵, tɯ¹¹
aɯ	aɯ	aɯ	n	U+0061 U+026f	91	Chuanqiandian, Northeast Yunnan	haɯ⁵⁵, tʂaɯ³³, ⁿdʱaɯ³⁵, naɯ⁵³, paɯ³³
ã	ã	ã	n	U+00e3	87	Chuanqiandian, Central Guizhou	lã²⁴, nã²², hã¹³, qã¹³, pã⁴²
y	y	y	n	U+0079	82	Luobuohe, Western,Qiandong, East,Luobuohe, Eastern,Chuanqiandian, Northeast Yunnan	ly⁵³, tsʰy⁵⁵, gy⁵⁵, tʰy¹¹, my⁵⁵
ẽ	ẽ	ẽ	n	U+1ebd	71	Qiandong, West,Chuanqiandian, Central Guizhou	kʰẽ⁵⁵, lẽ⁵⁵, tɕẽ²⁴, sẽ¹³, sʰẽ²⁴
ə̃	ə̃	ə̃	n	U+0259 U+0303	69	Chuanqiandian, Central Guizhou	ⁿqə̃⁵⁵, tə̃⁴², ⁿpə̃⁴², nə̃²⁴, sʰə̃⁴²
əu	əu	əu	n	U+0259 U+0075	62	Luobuohe, Western,Chuanqiandian, Southern Guizhou,Luobuohe, Eastern	zəu²⁴, ⁿtsəu⁵⁵, ⁿtəu⁵⁵, ləu⁵⁵, ʔəu⁵⁵
ey	ey	ey	n	U+0065 U+0079	54	Chuanqiandian, Northeast Yunnan	tsʰey¹¹, dey³³, ⁿtɕʰey⁵⁵, sey¹¹, tɬey¹¹
æ̃	æ̃	æ̃	n	U+00e6 U+0303	43	Qiandong, West	tæ̃³³, kæ̃⁴⁴, kæ̃⁴⁴, kæ̃⁴⁴, kæ̃⁴⁴
oi	oi	oi	n	U+006f U+0069	18	Qiandong, West	poi⁴⁴, poi⁴⁴, moi⁵⁵, poi³³, poi²¹
ĩ	ĩ	ĩ	n	U+0129	18	Chuanqiandian, Northeast Yunnan,Chuanqiandian, Central Guizhou	ʑĩ¹³, tĩ²², tĩ³¹, nĩ³¹, hĩ¹¹
ɪ	ɪ	ɪ	n	U+026a	18	Chuanqiandian, Southern Guizhou	lɪ¹³, hɪ²², ʐɪ¹¹, tɪ⁴⁴, lɪ¹³
eɯ	eɯ	eɯ	n	U+0065 U+026f	17	Qiandong, West	leɯ¹³, leɯ²¹, leɯ²², xʰeɯ¹¹, leɯ¹³
ʅ	ʅ	ʅ	n	U+0285	14	Chuanqiandian, Southern Guizhou,Chuanqiandian, Northeast Yunnan	tʅ¹¹, tʂʅ⁵⁵, ⁿʈʂʅ¹¹, ⁿʈʂʅ¹¹, tʂʅ³³
ø	ø	ø	n	U+00f8	4	Luobuohe, Western	m̥ø³¹, ʔø³¹, ⁿbø⁵⁵, pø³¹
ɑu	ɑu	ɑu	n	U+0251 U+0075	2	Luobuohe, Western	pɑu³⁵, kʰɑu⁵⁵
jaŋ	j a ŋ	j a ŋ	m n c	U+006a U+0020 U+0061 U+0020 U+014b	45	Luobuohe, Eastern,Qiandong, East,Baheng, East,Baheng, West,Qiandong, West	ljaŋ²², tjaŋ³⁵, ljaŋ²², tjaŋ³³, tjaŋ¹³
juŋ	j u ŋ	j u ŋ	m n c	U+006a U+0020 U+0075 U+0020 U+014b	36	Baheng, West,Qiandong, East,Qiandong, West,Luobuohe, Eastern,Baheng, East	ljuŋ³¹³, ʔjuŋ²⁴, tjuŋ²⁴, tjuŋ²², tjuŋ²⁴
waŋ	w a ŋ	w a ŋ	m n c	U+0077 U+0020 U+0061 U+0020 U+014b	16	Baheng, East,Baheng, West,Luobuohe, Eastern	ⁿɢwaŋ³¹, waŋ³³, waŋ³³, kwaŋ⁴⁴, ⁿɢwaŋ²⁴
wen	w e n	w e n	m n c	U+0077 U+0020 U+0065 U+0020 U+006e	13	Baheng, West,Luobuohe, Eastern,Luobuohe, Western	wen³³, wen³¹, qʰwen⁵⁵, wen⁵⁵, wen³¹
laŋ	l a ŋ	l a ŋ	m n c	U+006c U+0020 U+0061 U+0020 U+014b	12	Chuanqiandian, Southern Guizhou,Chuanqiandian,Luobuohe, Eastern	plaŋ⁴³, plaŋ⁴³, ⁿqlaŋ³¹, ⁿplaŋ⁵³, ⁿplaŋ⁵³
ien	i e n	i e n	m n c	U+0069 U+0020 U+0065 U+0020 U+006e	10	Qiandong, East	mien¹³, mien²², mien²², mien²², pien²⁴
joŋ	j o ŋ	j o ŋ	m n c	U+006a U+0020 U+006f U+0020 U+014b	10	Baheng, West,Luobuohe, Western	ljoŋ¹¹, joŋ³¹, ljoŋ³¹, joŋ¹³, vjoŋ³¹
uan	u a n	u a n	m n c	U+0075 U+0020 U+0061 U+0020 U+006e	9	Qiandong, East	tɕuan²², tʰuan⁴⁴, kuan²⁴, suan⁴⁴, tuan⁵³
jen	j e n	j e n	m n c	U+006a U+0020 U+0065 U+0020 U+006e	9	Luobuohe, Eastern,Qiandong, East,Luobuohe, Western	tjen²², mjen²⁴, ljen²², ljen⁴⁴, ʔjen³⁵
nen	n e n	n e n	m n c	U+006e U+0020 U+0065 U+0020 U+006e	8	Luobuohe, Eastern,Luobuohe, Western	ʔnen³⁵, ʔnen³³, ʔnen³¹, ʔnen³⁵, ʔnen³¹
len	l e n	l e n	m n c	U+006c U+0020 U+0065 U+0020 U+006e	8	Chuanqiandian, Southern Guizhou,Luobuohe, Western,Luobuohe, Eastern	qlen³¹, qlen³¹, ʔlen²⁴, ʔlen²⁴, ʔlen³¹
loŋ	l o ŋ	l o ŋ	m n c	U+006c U+0020 U+006f U+0020 U+014b	7	Chuanqiandian, Southern Guizhou,Chuanqiandian,Luobuohe, Western	ⁿbloŋ³¹, ⁿploŋ³¹, ploŋ⁴², ⁿbloŋ³¹, ⁿploŋ³¹
wɑŋ	w ɑ ŋ	w ɑ ŋ	m n c	U+0077 U+0020 U+0251 U+0020 U+014b	6	Luobuohe, Western	ⁿɢwɑŋ³¹, qʰwɑŋ⁵⁵, wɑŋ⁵⁵, qʰwɑŋ³¹, qwɑŋ³⁵
luŋ	l u ŋ	l u ŋ	m n c	U+006c U+0020 U+0075 U+0020 U+014b	5	Luobuohe, Eastern	ⁿbluŋ³¹, qluŋ⁵⁵, ⁿbluŋ³¹, pluŋ⁵⁵, qluŋ⁵⁵
noŋ	n o ŋ	n o ŋ	m n c	U+006e U+0020 U+006f U+0020 U+014b	5	Luobuohe, Western	ʔnoŋ⁵⁵, ʔnoŋ⁵⁵, ʔnoŋ⁵⁵, ʔnoŋ⁵⁵, ʔnoŋ⁵⁵
lɑŋ	l ɑ ŋ	l ɑ ŋ	m n c	U+006c U+0020 U+0251 U+0020 U+014b	4	Luobuohe, Western	qlɑŋ³¹, ʔlɑŋ³¹, ʔlɑŋ⁵⁵, qlɑŋ³¹
zaŋ	z a ŋ	z a ŋ	m n c	U+007a U+0020 U+0061 U+0020 U+014b	3	Luobuohe, Eastern	vzaŋ³³, vzaŋ³¹, vzaŋ³¹
lɛn	l ɛ n	l ɛ n	m n c	U+006c U+0020 U+025b U+0020 U+006e	2	Luobuohe, Eastern	qlɛn⁵⁵, qlɛn⁵⁵
ʐaŋ	ʐ a ŋ	ʐ a ŋ	m n c	U+0290 U+0020 U+0061 U+0020 U+014b	2	Chuanqiandian, Southern Guizhou	pʐaŋ³⁵, ⁿpʐaŋ²³²
muŋ	m u ŋ	m u ŋ	m n c	U+006d U+0020 U+0075 U+0020 U+014b	2	Luobuohe, Eastern	ʔmuŋ³¹, ʔmuŋ³¹
woŋ	w o ŋ	w o ŋ	m n c	U+0077 U+0020 U+006f U+0020 U+014b	2	Baheng, West	woŋ³⁵, woŋ³⁵
ʁen	ʁ e n	ʁ e n	m n c	U+0281 U+0020 U+0065 U+0020 U+006e	2	Luobuohe, Eastern	qʁen³³, qʁen³³
uaŋ	u a ŋ	u a ŋ	m n c	U+0075 U+0020 U+0061 U+0020 U+014b	2	Luobuohe, Eastern,Chuanqiandian	tʂuaŋ⁴³, tsʰuaŋ³³
wuŋ	w u ŋ	w u ŋ	m n c	U+0077 U+0020 U+0075 U+0020 U+014b	2	Baheng, East	wuŋ³³, wuŋ³³
iaŋ	i a ŋ	i a ŋ	m n c	U+0069 U+0020 U+0061 U+0020 U+014b	2	Luobuohe, Eastern,Baheng, West	siaŋ⁵⁵, hiaŋ⁵⁵
ʑɑŋ	ʑ ɑ ŋ	ʑ ɑ ŋ	m n c	U+0291 U+0020 U+0251 U+0020 U+014b	1	Luobuohe, Western	ʔʑɑŋ³¹
læn	l æ n	l æ n	m n c	U+006c U+0020 U+00e6 U+0020 U+006e	1	Chuanqiandian, Southern Guizhou	ⁿplæn⁵³
jɑŋ	j ɑ ŋ	j ɑ ŋ	m n c	U+006a U+0020 U+0251 U+0020 U+014b	1	Luobuohe, Western	jɑŋ⁵⁵
jiŋ	j i ŋ	j i ŋ	m n c	U+006a U+0020 U+0069 U+0020 U+014b	1	Baheng, West	jiŋ¹¹
ɹen	ɹ e n	ɹ e n	m n c	U+0279 U+0020 U+0065 U+0020 U+006e	1	Luobuohe, Eastern	qɹen³¹
uen	u e n	u e n	m n c	U+0075 U+0020 U+0065 U+0020 U+006e	1	Chuanqiandian	ʑuen³¹
ʑuŋ	ʑ u ŋ	ʑ u ŋ	m n c	U+0291 U+0020 U+0075 U+0020 U+014b	1	Luobuohe, Eastern	ʔʑuŋ⁵⁵
jøŋ	j ø ŋ	j ø ŋ	m n c	U+006a U+0020 U+00f8 U+0020 U+014b	1	Luobuohe, Western	jøŋ³¹
ʑin	ʑ i n	ʑ i n	m n c	U+0291 U+0020 U+0069 U+0020 U+006e	1	Luobuohe, Western	ʔʑin³⁵
ian	i a n	i a n	m n c	U+0069 U+0020 U+0061 U+0020 U+006e	1	Chuanqiandian, Southern Guizhou	tʰian²¹
ʑen	ʑ e n	ʑ e n	m n c	U+0291 U+0020 U+0065 U+0020 U+006e	1	Luobuohe, Eastern	ʔʑen²⁴
ɹaŋ	ɹ a ŋ	ɹ a ŋ	m n c	U+0279 U+0020 U+0061 U+0020 U+014b	1	Luobuohe, Eastern	qɹaŋ²⁴
ua	u a	u a	m n	U+0075 U+0020 U+0061	211	Luobuohe, Eastern,Chuanqiandian, Northeast Yunnan,Baheng, West,Qiandong, East,Baheng, East,Qiandong, West,Chuanqiandian, Southern Guizhou,Chuanqiandian	tʂua⁵⁵, tʂʰua⁴³, ʑua⁵⁵, pua¹³, ʂua⁴³
ja	j a	j a	m n	U+006a U+0020 U+0061	77	Chuanqiandian, Southern Guizhou,Qiandong, East,Luobuohe, Western,Baheng, East,Luobuohe, Eastern,Qiandong, West,Baheng, West	lja⁵⁵, lja⁵⁵, pja³³, lja⁴⁴, ⁿbja²⁴
je	j e	j e	m n	U+006a U+0020 U+0065	73	Qiandong, East,Chuanqiandian, Southern Guizhou,Qiandong, West,Luobuohe, Eastern,Baheng, West,Luobuohe, Western,Baheng, East	tje⁵⁵, ⁿpje³³, lje⁵³, je⁴², lje¹³
ji	j i	j i	m n	U+006a U+0020 U+0069	60	Luobuohe, Eastern,Baheng, West,Luobuohe, Western	ʔji³¹, ji²⁴, ji³⁵, ji³⁵, ⁿbji³¹
jei	j ei	j ei	m n	U+006a U+0020 U+0065 U+0069	54	Baheng, East,Baheng, West	ljei³⁵, jei³³, tʰjei⁵³, tjei⁵⁵, pjei⁵⁵
ue	u e	u e	m n	U+0075 U+0020 U+0065	48	Qiandong, East,Qiandong, West	tue⁴⁴, tue³³, tue⁴⁴, pʰue²⁴, pue²⁴
wa	w a	w a	m n	U+0077 U+0020 U+0061	48	Chuanqiandian, Central Guizhou,Chuanqiandian,Chuanqiandian, Northeast Yunnan,Baheng, West,Baheng, East,Chuanqiandian, Southern Guizhou,Luobuohe, Eastern	kwa⁵⁵, qwa³¹, qwa²⁴, kwa⁵⁵, kwa⁵⁵
jo	j o	j o	m n	U+006a U+0020 U+006f	44	Qiandong, East,Luobuohe, Eastern,Qiandong, West,Baheng, East,Baheng, West	ljo²⁴, jo³⁵, jo³⁵, pʰjo³⁵, mjo³¹
ie	i e	i e	m n	U+0069 U+0020 U+0065	44	Chuanqiandian, Central Guizhou,Baheng, East,Luobuohe, Eastern,Luobuohe, Western,Chuanqiandian, Northeast Yunnan	tsʰie⁵⁵, ⁿdzie³³, sie⁵⁵, sie⁵⁵, zie⁵⁵
ju	j u	j u	m n	U+006a U+0020 U+0075	41	Luobuohe, Western,Baheng, East,Baheng, West,Luobuohe, Eastern,Qiandong, West	tju²⁴, ju⁵⁵, tju³³, tju³³, ʔju⁵⁵
wei	w ei	w ei	m n	U+0077 U+0020 U+0065 U+0069	35	Chuanqiandian, Southern Guizhou,Chuanqiandian, Northeast Yunnan,Luobuohe, Western,Baheng, West,Luobuohe, Eastern,Baheng, East	wei¹¹, kwei³⁵, wei³¹, kwei³¹³, kwei³¹³
jeu	j eu	j eu	m n	U+006a U+0020 U+0065 U+0075	27	Baheng, East,Qiandong, West,Baheng, West,Qiandong, East	tjeu⁴⁴, ljeu³³, ljeu²², tjeu²⁴, tjeu⁵³
ɦa	ɦ a	ɦ a	m n	U+0266 U+0020 U+0061	23	Chuanqiandian, Northeast Yunnan	mɦa¹¹, mɦa¹¹, mɦa³⁵, ⁿbɦa³⁵, zɦa¹¹
ɦau	ɦ au	ɦ au	m n	U+0266 U+0020 U+0061 U+0075	22	Chuanqiandian, Northeast Yunnan	bɦau³⁵, mɦau³¹, bɦau³⁵, zɦau³¹, ɢɦau³¹
lo	l o	l o	m n	U+006c U+0020 U+006f	22	Chuanqiandian,Luobuohe, Western,Chuanqiandian, Northeast Yunnan,Luobuohe, Eastern,Chuanqiandian, Central Guizhou	plo²⁴, pʰlo⁴⁴, plo²⁴, qlo³¹, qlo³¹
zi	z i	z i	m n	U+007a U+0020 U+0069	21	Luobuohe, Eastern	pʰzi⁵⁵, ⁿpzi²⁴, ⁿpzi²⁴, pzi⁵⁵, pzi²⁴
ɦu	ɦ u	ɦ u	m n	U+0266 U+0020 U+0075	20	Chuanqiandian, Northeast Yunnan	ȵɦu³⁵, ȵɦu³⁵, ȵɦu³⁵, ȵɦu³⁵, ȵɦu³⁵
we	w e	w e	m n	U+0077 U+0020 U+0065	19	Chuanqiandian, Southern Guizhou,Luobuohe, Western,Baheng, East,Baheng, West	we³⁵, we⁵⁵, we⁵⁵, kwe⁴², we¹¹
ɦaɯ	ɦ aɯ	ɦ aɯ	m n	U+0266 U+0020 U+0061 U+026f	19	Chuanqiandian, Northeast Yunnan	zɦaɯ³⁵, dzɦaɯ³⁵, ʑɦaɯ³⁵, ⁿgɦaɯ³⁵, ʑɦaɯ³⁵
jɔ	j ɔ	j ɔ	m n	U+006a U+0020 U+0254	17	Chuanqiandian, Southern Guizhou,Qiandong, West	ljɔ⁴⁴, pjɔ⁴⁴, pjɔ⁴⁴, pjɔ¹¹, tjɔ⁵⁵
ləu	l əu	l əu	m n	U+006c U+0020 U+0259 U+0075	17	Luobuohe, Western,Luobuohe, Eastern	ʔləu⁵⁵, ⁿbləu³¹, ⁿbləu³¹, pləu³¹, pləu³¹
la	l a	l a	m n	U+006c U+0020 U+0061	16	Luobuohe, Western,Chuanqiandian,Chuanqiandian, Northeast Yunnan,Luobuohe, Eastern,Chuanqiandian, Central Guizhou	qla⁵⁵, qla⁵⁵, ⁿdla³¹, ʔla⁵⁵, ʔla⁵⁵
lu	l u	l u	m n	U+006c U+0020 U+0075	15	Chuanqiandian, Southern Guizhou,Luobuohe, Western,Chuanqiandian, Central Guizhou	ʔlu³¹, ʔlu⁵⁵, ⁿplu²², qlu⁵⁵, pʰlu²⁴
wo	w o	w o	m n	U+0077 U+0020 U+006f	14	Luobuohe, Western,Chuanqiandian, Northeast Yunnan,Baheng, West,Chuanqiandian, Southern Guizhou	kwo¹³, wo¹³, wo⁴⁴, kwo³⁵, wo³⁵
uei	u ei	u ei	m n	U+0075 U+0020 U+0065 U+0069	14	Chuanqiandian, Central Guizhou,Chuanqiandian,Luobuohe, Eastern,Chuanqiandian, Southern Guizhou	suei⁵⁵, tʰuei²⁴, kuei²⁴, huei³², huei³²
lei	l ei	l ei	m n	U+006c U+0020 U+0065 U+0069	14	Chuanqiandian, Southern Guizhou,Luobuohe, Western,Luobuohe, Eastern	ʁlei³¹, qlei⁵⁵, qlei⁵⁵, ʁlei³¹, ʁlei³¹
wai	w ai	w ai	m n	U+0077 U+0020 U+0061 U+0069	14	Baheng, East,Luobuohe, Eastern,Baheng, West	kwai³¹, wai²⁴, wai³³, kwai³³, wai³⁵
uæ	u æ	u æ	m n	U+0075 U+0020 U+00e6	13	Qiandong, West	luæ⁵⁵, kuæ¹³, kuæ¹³, kuæ⁴⁴, kuæ⁴⁴
jɛ	j ɛ	j ɛ	m n	U+006a U+0020 U+025b	13	Luobuohe, Eastern	ʔjɛ³³, ⁿbjɛ²⁴, jɛ⁵⁵, ⁿpjɛ³¹, ⁿbjɛ³³
wɑ	w ɑ	w ɑ	m n	U+0077 U+0020 U+0251	13	Luobuohe, Western	qwɑ³¹, qwɑ³¹, ʔwɑ⁵⁵, qwɑ³⁵, qwɑ³¹
lɛ	l ɛ	l ɛ	m n	U+006c U+0020 U+025b	13	Luobuohe, Eastern,Chuanqiandian, Central Guizhou	ⁿplɛ⁵⁵, ⁿplɛ³¹, ⁿplɛ⁵⁵, ⁿplɛ⁵⁵, ʔlɛ³¹
ui	u i	u i	m n	U+0075 U+0020 U+0069	12	Luobuohe, Western,Chuanqiandian, Northeast Yunnan,Chuanqiandian,Qiandong, West	kui⁵⁵, kui⁵⁵, tʂʰui³¹, tsui⁵⁵, tʂui⁴³
jou	j ou	j ou	m n	U+006a U+0020 U+006f U+0075	12	Qiandong, East	ljou²⁴, ljou³³, ljou³³, ljou³³, ljou³³
wi	w i	w i	m n	U+0077 U+0020 U+0069	11	Luobuohe, Western,Baheng, East,Baheng, West	ⁿkwi⁵⁵, wi¹¹, ⁿkwi³³, kwi⁵⁵, ⁿɢwi⁵⁵
wæ	w æ	w æ	m n	U+0077 U+0020 U+00e6	11	Luobuohe, Western,Chuanqiandian, Southern Guizhou	xwæ⁵⁵, wæ³⁵, qwæ³⁵, xwæ⁵⁵, wæ²²
ɦɯ	ɦ ɯ	ɦ ɯ	m n	U+0266 U+0020 U+026f	10	Chuanqiandian, Northeast Yunnan	ŋɦɯ³¹, vɦɯ¹¹, ⁿɢɦɯ¹¹, ɢɦɯ³⁵, ɢɦɯ³⁵
ɦai	ɦ ai	ɦ ai	m n	U+0266 U+0020 U+0061 U+0069	10	Chuanqiandian, Northeast Yunnan	vɦai³¹, dzɦai¹¹, ⁿɢɦai³⁵, ⁿɢɦai³⁵, ⁿɢɦai³⁵
lə	l ə	l ə	m n	U+006c U+0020 U+0259	10	Chuanqiandian, Southern Guizhou,Chuanqiandian, Central Guizhou	plə¹³, plə⁴², ⁿplə²², plə⁴², ⁿplə⁵⁵
ɦey	ɦ ey	ɦ ey	m n	U+0266 U+0020 U+0065 U+0079	9	Chuanqiandian, Northeast Yunnan	dzɦey³⁵, ɢɦey³⁵, ⁿgɦey³⁵, ⁿgɦey³⁵, ⁿgɦey³⁵
ɦo	ɦ o	ɦ o	m n	U+0266 U+0020 U+006f	9	Chuanqiandian, Northeast Yunnan	mɦo¹¹, ɢɦo³¹, ɢɦo³¹, ⁿgɦo³⁵, dzɦo³⁵
le	l e	l e	m n	U+006c U+0020 U+0065	9	Chuanqiandian, Central Guizhou,Chuanqiandian,Chuanqiandian, Southern Guizhou,Luobuohe, Western,Luobuohe, Eastern	ⁿble³³, ⁿple⁵⁵, ⁿple²¹, ple²⁴, ⁿple³¹
jy	j y	j y	m n	U+006a U+0020 U+0079	9	Luobuohe, Eastern,Luobuohe, Western	jy³¹, jy³⁵, ʔjy³⁵, ʔjy³¹, ʔjy³¹
ʐæ	ʐ æ	ʐ æ	m n	U+0290 U+0020 U+00e6	9	Chuanqiandian, Southern Guizhou	ⁿpʐæ⁵³, pʐæ⁴², pʐæ⁴², pʐæ⁴², pʐæ⁴²
uæ̃	u æ̃	u æ̃	m n	U+0075 U+0020 U+00e6 U+0303	8	Qiandong, West	kuæ̃⁴⁴, tɕuæ̃³³, kuæ̃⁴⁴, ɕuæ̃⁴⁴, ɕuæ̃³³
lõ	l õ	l õ	m n	U+006c U+0020 U+00f5	7	Chuanqiandian, Central Guizhou	ⁿplõ⁵⁵, plõ²⁴, mlõ²², plõ¹³, ⁿplõ⁵⁵
li	l i	l i	m n	U+006c U+0020 U+0069	7	Chuanqiandian,Chuanqiandian, Central Guizhou,Chuanqiandian, Northeast Yunnan	dʱli³⁵, pli¹³, dʱli³⁵, pʰli³³, dʱli³⁵
ʐe	ʐ e	ʐ e	m n	U+0290 U+0020 U+0065	7	Chuanqiandian, Southern Guizhou	ⁿpʐe¹¹, ⁿpʐe¹¹, ⁿpʐe¹¹, ⁿpʐe¹¹, ⁿpʐe¹¹
ʑu	ʑ u	ʑ u	m n	U+0291 U+0020 U+0075	7	Luobuohe, Eastern	ʔʑu³¹, ʔʑu³¹, ʔʑu³¹, ʔʑu³¹, ʔʑu³¹
wɔ	w ɔ	w ɔ	m n	U+0077 U+0020 U+0254	7	Chuanqiandian, Southern Guizhou	wɔ⁴², wɔ³⁵, wɔ³⁵, wɔ²³², wɔ²³²
lou	l ou	l ou	m n	U+006c U+0020 U+006f U+0075	7	Chuanqiandian	plou⁴³, plou⁴³, plou⁴³, ⁿplou²⁴, plou⁵⁴
uẽ	u ẽ	u ẽ	m n	U+0075 U+0020 U+1ebd	6	Qiandong, West	puẽ³³, tɕuẽ²², luẽ⁵³, tuẽ³³, ɕʰuẽ¹³
jau	j au	j au	m n	U+006a U+0020 U+0061 U+0075	6	Baheng, East	ⁿpjau³¹, ⁿpjau⁵⁵, ⁿpjau³¹, tjau³⁵, tjau³¹
wu	w u	w u	m n	U+0077 U+0020 U+0075	5	Qiandong, West,Baheng, West,Luobuohe, Western,Chuanqiandian, Southern Guizhou	wu¹³, wu¹³, wu¹³, wu⁵⁵, wu⁴⁴
lɑ	l ɑ	l ɑ	m n	U+006c U+0020 U+0251	5	Luobuohe, Western	ʔlɑ⁵⁵, qlɑ⁵⁵, ʔlɑ⁵⁵, qlɑ³¹, qlɑ³⁵
jeɯ	j eɯ	j eɯ	m n	U+006a U+0020 U+0065 U+026f	5	Qiandong, West	ljeɯ⁴⁴, ljeɯ⁴⁴, mjeɯ⁵⁵, ljeɯ⁴⁴, pjeɯ³³
jẽ	j ẽ	j ẽ	m n	U+006a U+0020 U+1ebd	5	Qiandong, West	mjẽ⁵⁵, tʰjẽ⁵³, tjẽ³³, tjẽ²², pʰjẽ⁵³
ɦi	ɦ i	ɦ i	m n	U+0266 U+0020 U+0069	5	Chuanqiandian, Northeast Yunnan	ȵɦi¹¹, ʑɦi³¹, ȵɦi³¹, ʑɦi³¹, ʑɦi³¹
lɔ	l ɔ	l ɔ	m n	U+006c U+0020 U+0254	4	Chuanqiandian, Southern Guizhou	plɔ³², plɔ⁵⁵, plɔ, plɔ
ʑo	ʑ o	ʑ o	m n	U+0291 U+0020 U+006f	4	Luobuohe, Western,Luobuohe, Eastern	ʔʑo³³, ʔʑo³³, ʔʑo²⁴, ʔʑo³⁵
leu	l eu	l eu	m n	U+006c U+0020 U+0065 U+0075	4	Luobuohe, Eastern,Luobuohe, Western,Chuanqiandian	pleu³¹, pleu³¹, pleu⁵⁵, ⁿpleu²⁴
ʐa	ʐ a	ʐ a	m n	U+0290 U+0020 U+0061	4	Chuanqiandian, Southern Guizhou	pʐa²², ⁿpʐa, ⁿpʐa, ⁿpʐa
lɯ	l ɯ	l ɯ	m n	U+006c U+0020 U+026f	4	Chuanqiandian, Southern Guizhou,Chuanqiandian, Central Guizhou	ⁿplɯ²², ⁿplɯ⁴², ⁿplɯ¹¹, plɯ²²
læ	l æ	l æ	m n	U+006c U+0020 U+00e6	4	Chuanqiandian, Southern Guizhou,Luobuohe, Western	ⁿblæ³¹, plæ³⁵, plæ³⁵, ⁿplæ⁵³
wau	w au	w au	m n	U+0077 U+0020 U+0061 U+0075	4	Baheng, East	kwau³⁵, kwau³⁵, kwau³⁵, kwau³⁵
